{
  "manifest_version": "apctt-public-cases-v1",
  "created": "2026-10-13",
  "source": "USGS_SDG_open_data_set.xlsx (organizer, 2026-10-13). The corrected sheet USGS_SDG_open_data_set_corrected.xlsx (2026-10-13, D79 and D80: 16 titles, 9 years, 18 page counts, 5 direct PDF URLs and 2 TRL assessment units corrected from the verified PDFs, each changed cell highlighted with a 'Was: ...' comment, and a status column naming the case of every row or why it was left out) matches this manifest.",
  "decisions": [
    "D74",
    "D77",
    "D80"
  ],
  "checklist_version": "APCTT-2026-CHECKLIST-v1",
  "licence_note": "USGS-authored or produced information is in the U.S. public domain and may be used without restriction; credit is requested (for example 'Credit: U.S. Geological Survey'; cite each report by its suggested citation or DOI). Caveat: not all material in USGS publications is public domain. 93 of the 100 PDFs (the 99 cases and USGS-SDG-067) state that the product 'may contain copyrighted materials as noted in the text' and that permission to reproduce copyrighted items must be secured from the copyright owner. Third-party items found by text search include Esri basemaps, Google Earth and Maxar imagery, National Geographic basemaps, CNES/SPOT imagery, Oregon ShoreZone photographs and an individually credited photograph. Distribute the PDFs unmodified with their USGS URLs and SHA-256 (or let teams fetch them from pubs.usgs.gov), do not reuse such figures separately, and do not use the USGS logo. Sources: https://www.usgs.gov/information-policies-and-instructions/copyrights-and-credits (the page could not be reached on 2026-10-13; its content was confirmed through search results), https://pubs.usgs.gov/documentation/faq (reviewed 2026-10-13).",
  "reference_label_meaning": "reference_labels.estimated_trl and reference_labels.rationale are the organizer's estimates from the sheet (columns Estimated TRL and TRL rationale). They are not expert labels per checklist criterion, they carry no evidence pages, and they are not the labels of the hidden evaluation cases. Use them to sanity-check a module, not as ground truth.",
  "inclusion_rule": "A case is included only if its PDF opens with pypdf 6.19.0 without a password, has at most 300 pages and at most 52,428,800 bytes (D77). Every case has one PDF document.",
  "limits_applied": {
    "max_documents": 3,
    "max_document_bytes": 52428800,
    "max_request_bytes": 83886080,
    "max_total_pages": 300,
    "case_time_limit_s": 180,
    "decision": "D77"
  },
  "measured_with": {
    "pypdf": "6.19.0",
    "python": "3.11.15",
    "text_layer_rule": "text_layer is true when at least half of all pages and at least half of the sampled pages (first 5 pages and 5 later pages spread over the document) yield 100 or more non-whitespace characters with pypdf extract_text()"
  },
  "assessment_target_type_mapping": "type follows the TRL assessment unit, not the sheet category. 'technology': models, model applications, software, analysis workflows, survey and mapping methods, map libraries and data products (92 cases). 'system': deployed observation, monitoring, warning or data-delivery arrangements made of field instruments or structures operated in the field (cases 6, 33, 89, 90, 91, 97 and 98; 97 is installed living-shoreline oyster-castle structures). 'component' and 'subsystem' are not used. Borderline: 27 (GNSS survey for an observation network) is 'technology' because the unit is a survey method; 50 (an 'inundation-map system') is 'technology' because it is a map library.",
  "intended_application_rule": "'<application phrase for the sheet category> for <SDG target text> (SDG target <n>)'; the phrase restates the category as an application (for example 'Water-quality treatment' -> 'Water-quality monitoring and constituent-load estimation', because both reports are about monitoring and surrogate models, not treatment).",
  "case_template": {
    "input_profile": "pdf_report",
    "schema_version": "the server's schema_version (GET /v1/package); tools/get_public_cases.py takes it from the kit configuration (--config) or --schema-version",
    "checklist_version": "APCTT-2026-CHECKLIST-v1",
    "assessment_as_of": null,
    "fields_from_manifest": [
      "case_id",
      "title",
      "assessment_target",
      "intended_application",
      "intended_environment",
      "sdg_targets",
      "documents[0] = document + content_base64 + sha256 (pdf_sha256)"
    ],
    "never_send": [
      "reference_labels",
      "publication_year",
      "category",
      "notes",
      "sheet_differences",
      "text_pages",
      "no",
      "sdg",
      "sdg_target",
      "pdf_url",
      "publication_url",
      "pdf_bytes",
      "page_count",
      "text_layer"
    ],
    "request_id": "PUBLIC-<case_id> (tools/get_public_cases.py); send a fresh request_id for every run",
    "document_file": "<case_id>.pdf in the folder given to tools/get_public_cases.py --dir; the PDFs are not part of the kit"
  },
  "statistics": {
    "cases": 99,
    "excluded": 1,
    "pdf_mib": {
      "median": 7.91,
      "p95": 28.84,
      "max": 49.3,
      "min": 0.98,
      "total": 1061.4
    },
    "pages": {
      "median": 44,
      "p95": 126.2,
      "max": 208,
      "min": 20,
      "total": 5416
    },
    "by_sdg": {
      "6": 25,
      "11": 25,
      "13": 24,
      "14": 25
    },
    "by_estimated_trl": {
      "4": 1,
      "5": 12,
      "6": 54,
      "7": 29,
      "8": 1,
      "9": 2
    },
    "by_type": {
      "technology": 92,
      "system": 7
    }
  },
  "smoke_cases": [
    "USGS-SDG-012",
    "USGS-SDG-040",
    "USGS-SDG-061"
  ],
  "smoke_case_reason": "Small text-layer PDFs (0.98, 1.32 and 2.52 MiB; 24, 22 and 36 pages; full pypdf text extraction under 1 s each on a development Mac), one per SDG 6, 11 and 13 and with different estimated TRLs (4, 7 and 6).",
  "excluded": [
    {
      "no": 67,
      "case_id": "USGS-SDG-067",
      "title": "A model for evaluating stream temperature response to climate change in Wisconsin",
      "pdf_url": "https://pubs.usgs.gov/sir/2014/5186/pdf/sir2014-5186.pdf",
      "pdf_sha256": "e4ac34fe6da0020be7b45090f75b68c7140f96e5b10994d74b0f2fe5cfb4de9a",
      "pdf_bytes": 218224645,
      "page_count": 78,
      "reason": "PDF is 218,224,645 bytes (208.1 MiB), over max_document_bytes 52,428,800 (50 MiB) (D77); a single-document request would also exceed max_request_bytes (base64 about 277 MiB)"
    }
  ],
  "cases": [
    {
      "no": 1,
      "case_id": "USGS-SDG-001",
      "sdg": 6,
      "sdg_target": "6.5 Integrated water-resource management",
      "category": "Hydraulic model calibration",
      "title": "Hydrologic and hydraulic analyses of selected streams in Richland County, Ohio",
      "publication_year": 2019,
      "publication_url": "https://pubs.usgs.gov/publication/sir20195011",
      "pdf_url": "https://pubs.usgs.gov/sir/2019/5011/sir20195011.pdf",
      "pdf_sha256": "40636d0aff7e11e846b9c7231a9873af6eac813b349806338e8447d0900a58d1",
      "pdf_bytes": 2803719,
      "page_count": 26,
      "text_layer": true,
      "assessment_target": {
        "target_id": "USGS-SDG-001-T1",
        "type": "technology",
        "description": "Richland County HEC-RAS flood-analysis model"
      },
      "intended_application": "Calibrated hydraulic modelling of flood levels and floodways for integrated water-resource management (SDG target 6.5)",
      "intended_environment": "Clear Fork Mohican River and other selected streams, Richland County, Ohio, USA (riverine floodplains)",
      "reference_labels": {
        "estimated_trl": 6,
        "rationale": "The Clear Fork Mohican River model was calibrated to 16 flood events and used to produce water levels and inundation boundaries for selected flood frequencies.",
        "label_origin": "organizer estimate in USGS_SDG_open_data_set.xlsx; not an expert criterion label"
      },
      "sdg_targets": [
        6
      ],
      "document": {
        "document_id": "D001",
        "title": "Hydrologic and hydraulic analyses of selected streams in Richland County, Ohio",
        "document_date": "2019",
        "language": "en",
        "format": "pdf"
      },
      "text_pages": {
        "pages_with_100_chars": 26,
        "pages_without_text": 0
      }
    },
    {
      "no": 2,
      "case_id": "USGS-SDG-002",
      "sdg": 6,
      "sdg_target": "6.5 Integrated water-resource management",
      "category": "Hydraulic model calibration",
      "title": "Hydrologic and hydraulic analyses of selected streams in Stark County, Ohio",
      "publication_year": 2020,
      "publication_url": "https://pubs.usgs.gov/publication/sir20205011",
      "pdf_url": "https://pubs.usgs.gov/sir/2020/5011/sir20205011.pdf",
      "pdf_sha256": "cf9eda74922a1f4f5e864cade196e0b42b557cf3d203b1cba53c45741535ba2c",
      "pdf_bytes": 1319099,
      "page_count": 24,
      "text_layer": true,
      "assessment_target": {
        "target_id": "USGS-SDG-002-T1",
        "type": "technology",
        "description": "Hydrologic and hydraulic models for 14 streams in Stark County"
      },
      "intended_application": "Calibrated hydraulic modelling of flood levels and floodways for integrated water-resource management (SDG target 6.5)",
      "intended_environment": "14 streams in Stark County, Ohio, USA (riverine floodplains, about 50 river miles)",
      "reference_labels": {
        "estimated_trl": 6,
        "rationale": "Streamgage records, regional regression equations, and surveyed cross sections were combined over approximately 50 miles to calculate flood levels and regulatory floodways.",
        "label_origin": "organizer estimate in USGS_SDG_open_data_set.xlsx; not an expert criterion label"
      },
      "sdg_targets": [
        6
      ],
      "document": {
        "document_id": "D001",
        "title": "Hydrologic and hydraulic analyses of selected streams in Stark County, Ohio",